{
  "sourceIndex": 0,
  "jobId": "4440290852",
  "title": "Staff Production Engineer",
  "company": "GitHub",
  "location": "United States",
  "linkedinUrl": "https://www.linkedin.com/jobs/view/4440290852",
  "status": "ACTIVE",
  "actionUrl": "https://www.github.careers/careers-home/jobs/5544",
  "officialUrl": "https://www.github.careers/careers-home/jobs/5544",
  "safeToPublish": true,
  "reviewRequired": false,
  "usefulClassification": true,
  "confidence": 1,
  "sourceProvider": "employer_site",
  "evidence": [
    "linkedin_about_website_direct",
    "linkedin_description_loaded",
    "linkedin_apply_method:OFFSITE",
    "verified_company_website_map",
    "ats_link_on_career_page",
    "official_site_inventory_miss:icims",
    "icims_public_search_inventory",
    "icims_query:staff production engineer",
    "official_inventory_empty",
    "search_results:7",
    "company_branded_job_domain",
    "company_identity_from_visible_title",
    "company_identity_from_verified_domain",
    "jobposting_jsonld",
    "description_fingerprint:1.000",
    "description_fingerprint_from_jobposting_jsonld",
    "strict_title_and_company_match",
    "verified_search_index_resolution",
    "search_candidates:7",
    "trusted_candidates_checked:1"
  ],
  "checkedAt": "2026-07-28T12:54:53.697441+00:00",
  "original": {
    "jobId": "4440290852",
    "jobUrl": "https://www.linkedin.com/jobs/view/4440290852",
    "jobTitle": "Staff Production Engineer",
    "companyName": "GitHub",
    "companyUrl": "https://www.linkedin.com/company/github",
    "location": "United States"
  }
}
