{
  "sourceIndex": 0,
  "jobId": "4432033614",
  "title": "Staff Software Engineer, Electron & Browser Infrastructure - Slack Desktop",
  "company": "Slack",
  "location": "California, United States",
  "linkedinUrl": "https://www.linkedin.com/jobs/view/4432033614",
  "status": "ACTIVE",
  "actionUrl": "https://salesforce.wd12.myworkdayjobs.com/Slack/job/Georgia---Atlanta/Staff-Software-Engineer--Electron---Browser-Infrastructure---Slack-Desktop_JR345720",
  "officialUrl": "https://salesforce.wd12.myworkdayjobs.com/Slack/job/Georgia---Atlanta/Staff-Software-Engineer--Electron---Browser-Infrastructure---Slack-Desktop_JR345720",
  "safeToPublish": true,
  "reviewRequired": false,
  "usefulClassification": true,
  "confidence": 0.97,
  "sourceProvider": "workday",
  "evidence": [
    "linkedin_about_website_direct",
    "linkedin_description_loaded",
    "linkedin_apply_method:OFFSITE",
    "verified_company_website_map",
    "ats_link_on_career_page",
    "official_site_inventory_miss:workday",
    "workday_cxs_api:query=staff software engineer electron browser infrastructure slack desktop",
    "official_inventory_empty",
    "fallback_search_results:9",
    "known_ats_domain",
    "workday_cxs_detail_api",
    "workday_apply_state:true",
    "description_fingerprint:1.000",
    "company_identity_visible_in_official_content",
    "strict_title_and_company_match",
    "search_candidates:9",
    "trusted_candidates_checked:1"
  ],
  "checkedAt": "2026-07-28T12:41:06.620042+00:00",
  "original": {
    "jobId": "4432033614",
    "jobUrl": "https://www.linkedin.com/jobs/view/4432033614",
    "jobTitle": "Staff Software Engineer, Electron & Browser Infrastructure - Slack Desktop",
    "companyName": "Slack",
    "companyUrl": "https://www.linkedin.com/company/tiny-spec-inc",
    "location": "California, United States"
  }
}
